{
  "truth_anchor": "PASS",
  "sovereignty_privacy": "PASS",
  "scores": {
    "resonance_over_noise": 2,
    "patterned_awakening": 2,
    "collective_coherence": 1,
    "integrity": 2,
    "tech_as_transcendence": 2,
    "accessibility": 1,
    "performance": 2,
    "telemetry_consent": 2
  },
  "warns": [
    "Collective coherence is not fully realized in this initial version.",
    "A full accessibility audit has not been performed."
  ],
  "owner_signoff": "Awaiting Signoff"
}